comments,localized_comment,hinglish,host_name,city,area,sentiment,is_mixed_sentiment,source,original_length,original_word_count,hinglish_word_count,hinglish_length
"Derk's houseboat is the absolute best place to stay in Amsterdam. There's no better way to experience the city than by staying on the end of a quiet canal in a great area, surrounded by restaurants and walking distance to the museums. The houseboat is spacious and comes with all the comforts of home with the added addition of being able to sit up on deck and take in the canal life. Derk was a great host, going over the quirks of the accommodations and surrounding area with us. Can't wait to come back to Amsterdam and stay here again.","Divya's Bangalore is the absolute best place to stay in Bangalore. There's no better way to experience the city than by staying on the end of a quiet canal in a great area, surrounded by restaurants and walking distance to the museums. The Bangalore is spacious and comes with all the comforts of home with the added addition of being able to sit up on deck and take in the canal life. Divya was a great host, going over the quirks of the accommodations and surrounding area with us. Can't wait to come back to Bangalore and stay here again.","Divya ki place Jayanagar mein, metro ke paas, colony ke andar, budget ke hisaab se ekdum acha hai, yaar 🙌, geyser slow tha 😐",Divya,Bangalore,Jayanagar,positive,True,real,539,100,24,124
Overpriced for the quality. Total waste of money.,Overpriced for the quality. Total waste of money.,"Indiranagar mein Priya ka stay bekar tha, waste of money tha, total bakwaas.",Priya,Bangalore,Indiranagar,negative,False,synthetic,49,8,13,76
"We stayed on Derk's boat for a long weekend in Amsterdam. It was great! Sadly we didn't meet Derk, as he was on holiday, so we didn't get to learn the history of the boat as some other guests have. But he left us in good hands with a friend, who met us at the boat to give us the keys and show us around. Rain on the boat's roof is the most soothing thing at nighttime... slept like a baby!!! ","We stayed on Swati's boat for a long weekend in Delhi. It was great! Sadly we didn't meet Swati, as he was on holiday, so we didn't get to learn the history of the boat as some other guests have. But he left us in good hands with a friend, who met us at the boat to give us the keys and show us around. Rain on the boat's roof is the most soothing thing at nighttime... slept like a baby!!! ","""Saket mein Swati ki place sahi tha, metro ke paas hai 🚂, budget ke hisaab se ekdum mast! 😊""",Swati,Delhi,Saket,positive,False,real,393,81,19,92
Okay for a one-night stay. Would look for better options next time.,Okay for a one-night stay. Would look for better options next time.,"Lajpat Nagar mein yeh stay average laga, theek tha for one night, but next time kuch better options dekhoonga.",Kavya,Delhi,Lajpat Nagar,neutral,True,synthetic,67,12,19,110
Daniel was a fantastic host and we would absolutely stay again with him. Everything was as advertised and you can easily get anywhere from his apartment. ,Siddharth was a fantastic host and we would absolutely stay again with him. Everything was as advertised and you can easily get anywhere from his apartment. ,"Yaar, Siddharth ka hostel Powai mein metro ke paas colony ke andar, budget ke hisaab se ekdum sahi hai, mast tha 🤩",Siddharth,Mumbai,Powai,positive,False,real,154,26,22,114
